[
  {
    "id": "INIT0001",
    "name": "Strategic Initiative 1",
    "description": "Customer initiative for Customer Experience",
    "pillar": "Operational Excellence",
    "type": "Growth",
    "sponsor": "Director Risk",
    "owner": "head680",
    "owner_username": "head982",
    "start_date": "2025-10-08",
    "target_end_date": "2027-10-08",
    "actual_end_date": "",
    "completion_pct": 88,
    "status": "On Track",
    "rag_status": "Green",
    "budget_kes_m": 21.2,
    "spent_kes_m": 134.9,
    "expected_roi_pct": 48.9,
    "actual_roi_pct": 0,
    "linked_projects": 4,
    "linked_kpis": [
      "K087",
      "K013",
      "K098",
      "K027",
      "K002"
    ],
    "linked_bsc_kpis": [
      "K002",
      "K042",
      "K005"
    ],
    "key_milestones": 12,
    "milestones_met": 5,
    "department": "Executive",
    "stakeholders": 3,
    "risks_identified": 0,
    "risks_mitigated": 5,
    "last_updated": "2026-04-16",
    "next_review": "2026-05-22",
    "executive_summary": "Initiative driving digital transformation outcomes",
    "notes": ""
  },
  {
    "id": "INIT0002",
    "name": "Strategic Initiative 2",
    "description": "Innovation initiative for Customer Experience",
    "pillar": "People & Culture",
    "type": "Growth",
    "sponsor": "Director Commercial",
    "owner": "head492",
    "owner_username": "head459",
    "start_date": "2025-08-27",
    "target_end_date": "2026-08-27",
    "actual_end_date": "",
    "completion_pct": 84,
    "status": "On Track",
    "rag_status": "Green",
    "budget_kes_m": 189.6,
    "spent_kes_m": 128.8,
    "expected_roi_pct": 71.3,
    "actual_roi_pct": 0,
    "linked_projects": 4,
    "linked_kpis": [
      "K055",
      "K007"
    ],
    "linked_bsc_kpis": [
      "K042",
      "K041"
    ],
    "key_milestones": 9,
    "milestones_met": 11,
    "department": "IT",
    "stakeholders": 4,
    "risks_identified": 7,
    "risks_mitigated": 1,
    "last_updated": "2026-03-29",
    "next_review": "2026-05-08",
    "executive_summary": "Initiative driving financial performance outcomes",
    "notes": ""
  },
  {
    "id": "INIT0003",
    "name": "Strategic Initiative 3",
    "description": "Cost Reduction initiative for Customer Experience",
    "pillar": "Operational Excellence",
    "type": "Risk Management",
    "sponsor": "Director IT",
    "owner": "head271",
    "owner_username": "head537",
    "start_date": "2025-07-13",
    "target_end_date": "2026-01-09",
    "actual_end_date": "",
    "completion_pct": 89,
    "status": "On Track",
    "rag_status": "Green",
    "budget_kes_m": 37.1,
    "spent_kes_m": 53.4,
    "expected_roi_pct": 76.5,
    "actual_roi_pct": 0,
    "linked_projects": 1,
    "linked_kpis": [
      "K084",
      "K077",
      "K056",
      "K079",
      "K100"
    ],
    "linked_bsc_kpis": [
      "K003",
      "K005",
      "K001"
    ],
    "key_milestones": 11,
    "milestones_met": 3,
    "department": "Strategy",
    "stakeholders": 11,
    "risks_identified": 5,
    "risks_mitigated": 4,
    "last_updated": "2026-03-27",
    "next_review": "2026-05-08",
    "executive_summary": "Initiative driving operational excellence outcomes",
    "notes": ""
  },
  {
    "id": "INIT0004",
    "name": "Strategic Initiative 4",
    "description": "Cost Reduction initiative for Operational Excellence",
    "pillar": "Financial Performance",
    "type": "Risk Management",
    "sponsor": "Director Retail",
    "owner": "head837",
    "owner_username": "head470",
    "start_date": "2026-02-24",
    "target_end_date": "2028-02-24",
    "actual_end_date": "",
    "completion_pct": 53,
    "status": "On Track",
    "rag_status": "Amber",
    "budget_kes_m": 10.0,
    "spent_kes_m": 2.8,
    "expected_roi_pct": 53.6,
    "actual_roi_pct": 0,
    "linked_projects": 2,
    "linked_kpis": [
      "K021",
      "K015",
      "K025",
      "K034"
    ],
    "linked_bsc_kpis": [
      "K042",
      "K041",
      "K003",
      "K001"
    ],
    "key_milestones": 11,
    "milestones_met": 9,
    "department": "IT",
    "stakeholders": 12,
    "risks_identified": 6,
    "risks_mitigated": 5,
    "last_updated": "2026-04-06",
    "next_review": "2026-05-24",
    "executive_summary": "Initiative driving operational excellence outcomes",
    "notes": ""
  },
  {
    "id": "INIT0005",
    "name": "Strategic Initiative 5",
    "description": "Compliance initiative for Operational Excellence",
    "pillar": "Risk & Compliance",
    "type": "Innovation",
    "sponsor": "Director Commercial",
    "owner": "head647",
    "owner_username": "head631",
    "start_date": "2025-08-13",
    "target_end_date": "2026-02-09",
    "actual_end_date": "",
    "completion_pct": 83,
    "status": "On Track",
    "rag_status": "Green",
    "budget_kes_m": 125.0,
    "spent_kes_m": 94.7,
    "expected_roi_pct": 34.0,
    "actual_roi_pct": 0,
    "linked_projects": 3,
    "linked_kpis": [
      "K055",
      "K035",
      "K071"
    ],
    "linked_bsc_kpis": [
      "K001",
      "K041",
      "K002"
    ],
    "key_milestones": 9,
    "milestones_met": 2,
    "department": "IT",
    "stakeholders": 5,
    "risks_identified": 5,
    "risks_mitigated": 3,
    "last_updated": "2026-04-15",
    "next_review": "2026-05-18",
    "executive_summary": "Initiative driving risk & compliance outcomes",
    "notes": ""
  },
  {
    "id": "INIT0006",
    "name": "Strategic Initiative 6",
    "description": "Innovation initiative for People & Culture",
    "pillar": "Digital Transformation",
    "type": "Growth",
    "sponsor": "MD",
    "owner": "head133",
    "owner_username": "head614",
    "start_date": "2026-02-26",
    "target_end_date": "2028-02-26",
    "actual_end_date": "",
    "completion_pct": 60,
    "status": "On Track",
    "rag_status": "Amber",
    "budget_kes_m": 162.1,
    "spent_kes_m": 45.1,
    "expected_roi_pct": 34.5,
    "actual_roi_pct": 0,
    "linked_projects": 2,
    "linked_kpis": [
      "K029",
      "K040",
      "K028",
      "K078",
      "K012"
    ],
    "linked_bsc_kpis": [
      "K041",
      "K002",
      "K003"
    ],
    "key_milestones": 6,
    "milestones_met": 4,
    "department": "IT",
    "stakeholders": 13,
    "risks_identified": 5,
    "risks_mitigated": 6,
    "last_updated": "2026-04-10",
    "next_review": "2026-05-08",
    "executive_summary": "Initiative driving operational excellence outcomes",
    "notes": ""
  },
  {
    "id": "INIT0007",
    "name": "Strategic Initiative 7",
    "description": "Compliance initiative for Financial Performance",
    "pillar": "Operational Excellence",
    "type": "Cost Reduction",
    "sponsor": "MD",
    "owner": "head365",
    "owner_username": "head212",
    "start_date": "2025-11-16",
    "target_end_date": "2027-11-16",
    "actual_end_date": "",
    "completion_pct": 91,
    "status": "On Track",
    "rag_status": "Green",
    "budget_kes_m": 158.1,
    "spent_kes_m": 25.7,
    "expected_roi_pct": 51.6,
    "actual_roi_pct": 0,
    "linked_projects": 4,
    "linked_kpis": [
      "K101",
      "K026",
      "K102",
      "K035"
    ],
    "linked_bsc_kpis": [
      "K041",
      "K042"
    ],
    "key_milestones": 3,
    "milestones_met": 12,
    "department": "IT",
    "stakeholders": 4,
    "risks_identified": 3,
    "risks_mitigated": 7,
    "last_updated": "2026-04-22",
    "next_review": "2026-05-07",
    "executive_summary": "Initiative driving risk & compliance outcomes",
    "notes": ""
  },
  {
    "id": "INIT0008",
    "name": "Strategic Initiative 8",
    "description": "Compliance initiative for Financial Performance",
    "pillar": "Operational Excellence",
    "type": "Growth",
    "sponsor": "Director Risk",
    "owner": "head517",
    "owner_username": "head584",
    "start_date": "2026-02-20",
    "target_end_date": "2027-08-14",
    "actual_end_date": "",
    "completion_pct": 85,
    "status": "On Track",
    "rag_status": "Green",
    "budget_kes_m": 189.2,
    "spent_kes_m": 93.5,
    "expected_roi_pct": 60.8,
    "actual_roi_pct": 0,
    "linked_projects": 5,
    "linked_kpis": [
      "K078",
      "K010",
      "K105"
    ],
    "linked_bsc_kpis": [
      "K003",
      "K002"
    ],
    "key_milestones": 12,
    "milestones_met": 2,
    "department": "Strategy",
    "stakeholders": 7,
    "risks_identified": 2,
    "risks_mitigated": 7,
    "last_updated": "2026-04-13",
    "next_review": "2026-05-11",
    "executive_summary": "Initiative driving risk & compliance outcomes",
    "notes": ""
  },
  {
    "id": "INIT0009",
    "name": "Strategic Initiative 9",
    "description": "Innovation initiative for Operational Excellence",
    "pillar": "Risk & Compliance",
    "type": "Compliance",
    "sponsor": "Director IT",
    "owner": "head218",
    "owner_username": "head806",
    "start_date": "2025-08-07",
    "target_end_date": "2026-08-07",
    "actual_end_date": "",
    "completion_pct": 22,
    "status": "At Risk",
    "rag_status": "Red",
    "budget_kes_m": 99.2,
    "spent_kes_m": 121.3,
    "expected_roi_pct": 79.0,
    "actual_roi_pct": 0,
    "linked_projects": 1,
    "linked_kpis": [
      "K020",
      "K066",
      "K083"
    ],
    "linked_bsc_kpis": [
      "K042",
      "K041",
      "K001",
      "K005"
    ],
    "key_milestones": 8,
    "milestones_met": 8,
    "department": "Retail",
    "stakeholders": 11,
    "risks_identified": 5,
    "risks_mitigated": 5,
    "last_updated": "2026-04-02",
    "next_review": "2026-05-07",
    "executive_summary": "Initiative driving risk & compliance outcomes",
    "notes": ""
  },
  {
    "id": "INIT0010",
    "name": "Strategic Initiative 10",
    "description": "Compliance initiative for Operational Excellence",
    "pillar": "Financial Performance",
    "type": "Cost Reduction",
    "sponsor": "CFO",
    "owner": "head771",
    "owner_username": "head636",
    "start_date": "2025-12-10",
    "target_end_date": "2027-06-03",
    "actual_end_date": "",
    "completion_pct": 64,
    "status": "On Track",